{
  "pluginId": "com.astrbot.android.plugin.test",
  "title": "Test plugin",
  "author": "Astrbot Android",
  "description": "Test",
  "entrySummary": "测试插件",
  "repoUrl": "https://github.com/undertaker33/astrbot_android_test_plugin",
  "scenarios": [
    "市场测试",
    "列表测试"
  ],
  "versions": [
    {
      "version": "1.0.0",
      "packageUrl": "https://github.com/undertaker33/astrbot_android_test_plugin/releases/download/v1/v1.zip",
      "protocolVersion": 1,
      "minHostVersion": "0.4.0",
      "maxHostVersion": "",
      "permissions": [],
      "changelog": "test"
    }
  ]
}
