{
  "pluginId": "cc.astrbot.android.plugin.meme_manager.native",
  "title": "表情管理器 Android Native",
  "author": "93445",
  "description": "AstrBot Android Native QuickJS 外部插件：迁移桌面端表情包回复链路、/表情管理 指令和内置 memes 资源。",
  "entrySummary": "支持聊天触发表情图回复，并保留 /表情管理 命令入口与资源统计能力。",
  "repoUrl": "https://github.com/undertaker33/astrbot_android_plugin_memes",
  "scenarios": [
    "表情包回复",
    "表情管理"
  ],
  "versions": [
    {
      "version": "0.1.0",
      "packageUrl": "https://github.com/undertaker33/astrbot_android_plugin_memes/releases/download/v1/astrbot_android_native_meme_manager.zip",
      "publishedAt": 1775459798000,
      "protocolVersion": 1,
      "minHostVersion": "0.4.0",
      "maxHostVersion": "",
      "permissions": [],
      "changelog": "Initial public Android Native market release."
    }
  ]
}
